{
  "name": "FruitHalf",
  "script": "FruitHalf",
  "tags": [
    "fruitHalf"
  ],
  "visual": {
    "type": "image",
    "texture": "fruit_coconut_left",
    "width": 66,
    "height": 66
  },
  "collider": {
    "body": "dynamic",
    "shape": "circle",
    "radius": 13.86,
    "gravity": true
  },
  "config": {
    "fruitType": "coconut",
    "side": "left",
    "velocityX": 0,
    "velocityY": -120,
    "spin": 3,
    "weight": 1.7,
    "cleanupMargin": 140,
    "texture": "fruit_coconut_left",
    "depth": 90,
    "tiltAngle": 0.22,
    "ttl": 2.5
  }
}
