{
  "name": "Fruit",
  "script": "Fruit",
  "tags": [
    "fruit",
    "sliceable"
  ],
  "visual": {
    "type": "image",
    "texture": "fruit_coconut_whole",
    "width": 66,
    "height": 66
  },
  "collider": {
    "body": "dynamic",
    "shape": "circle",
    "radius": 33,
    "gravity": true
  },
  "config": {
    "fruitType": "coconut",
    "score": 35,
    "weight": 1.7,
    "velocityX": 0,
    "velocityY": -560,
    "missY": 620,
    "cleanupMargin": 120,
    "sliced": false,
    "wholeTexture": "fruit_coconut_whole",
    "leftTexture": "fruit_coconut_left",
    "rightTexture": "fruit_coconut_right",
    "depth": 100,
    "minReadableTimeForMiss": 0.45
  }
}
